Source,Project ID,Project Name,Category,Description,Homepage URL,PMC,Podling,Start Date,Status
projects,Apache Accumulo,Apache Accumulo,big-data,"The Apache Accumulo sorted, distributed key/value store is
      based on Google's BigTable design. It is built on top of Apache Hadoop,
      Apache Zookeeper, and Apache Thrift. It features a few novel improvements
      on the BigTable design in the form of cell-level access labels and a
      server-side programming mechanism that can modify key/value pairs at
      various points in the data management process.",https://accumulo.apache.org,accumulo,False,Unknown,Unknown
projects,Apache ActiveMQ,Apache ActiveMQ,"network-server, network-client",ActiveMQ is a fast and powerful Message Broker which supports many Cross Language Clients and Protocols and many advanced features while fully supporting JMS 1.1 and J2EE 1.4.,http://activemq.apache.org/,activemq,False,Unknown,Unknown
projects,Apache AGE,Apache AGE,database,"The goal of Apache AGE™ is to provide graph data processing and analytics capability to all relational databases.

Through Apache AGE, PostgreSQL users will gain access to graph query modeling within the existing relational database.
",https://age.apache.org/,age,False,Unknown,Unknown
projects,Apache Airavata,Apache Airavata,"network-server, cloud, big-data","Apache Airavata is a micro-service architecture based software framework for
            executing and managing computational jobs and workflows on distributed computing
            resources including local clusters, supercomputers, national grids, academic and
            commercial clouds. Airavata is dominantly used to build Web-based science gateways and
            assist to compose, manage, execute, and monitor large scale applications (wrapped as Web
            services) and workflows composed of these services.",http://airavata.apache.org,airavata,False,Unknown,Unknown
projects,Apache Airflow,Apache Airflow,big-data,"The mission of Apache Airflow is the creation and maintenance of software
related to workflow automation and scheduling that can be used to author and
manage data pipelines.
",https://airflow.apache.org,airflow,False,Unknown,Unknown
projects,Apache Allura,Apache Allura,content,"Apache Allura is an open source implementation of a software ""forge"", a web site that manages source code repositories, bug reports, discussions, wiki pages, blogs and more for any number of individual projects.",http://allura.apache.org,allura,False,Unknown,Unknown
projects,Apache Ambari,Apache Ambari,big-data,"Apache Ambari makes Hadoop cluster provisioning, managing, and monitoring dead simple.",http://ambari.apache.org,ambari,False,Unknown,Unknown
projects,Apache Ant,Apache Ant,build-management,Apache Ant is a Java-based build tool.,http://ant.apache.org,ant,False,Unknown,Unknown
projects,Apache AntUnit,Apache AntUnit,"build-management, testing","The Ant Library provides Ant tasks for testing Ant
      task, it can also be used to drive functional and integration tests
      of arbitrary applications with Ant.",http://ant.apache.org/antlibs/antunit/,ant,False,Unknown,Unknown
projects,Apache Compress Ant Library,Apache Compress Ant Library,build-management,"This is a library of Ant tasks and types uses Apache
      Commons Compress to support additional archive formats like ar,
      pack200, xz and cpio.",http://ant.apache.org/antlibs/compress/,ant,False,Unknown,Unknown
projects,Apache .NET Ant Library,Apache .NET Ant Library,build-management,"This is a library of Ant tasks that help developing
.NET software.  It includes the ""old"" .NET tasks like a C# compiler task but also comes with support for NUnit testing or running the popular NAnt or MSBuild build tools.",http://ant.apache.org/antlibs/dotnet/,ant,False,Unknown,Unknown
projects,Apache Ivy,Apache Ivy,build-management,"Apache Ivy is a very powerful dependency manager oriented toward Java dependency management, even though it could be used to manage dependencies of any kind.",http://ant.apache.org/ivy/,ant,False,Unknown,Unknown
projects,Apache IvyDE,Apache IvyDE,build-management,"The now retired IvyDE lets you manage your dependencies declared in an ivy.xml in your Java Eclipse projects. IvyDE will contribute to the classpath of your Java project, with the classpath container. It also bring an editor of ivy.xml files, with completion.",http://ant.apache.org/ivyde/,ant,False,Unknown,Unknown
projects,Apache Props Ant Library,Apache Props Ant Library,build-management,"The Apache Props Antlib is a library of supplementary handlers for Apache Ant properties resolution.

The types provided are instances of org.apache.tools.ant.PropertyHelper.Delegate and can be invoked using the <propertyhelper> task provided in Ant 1.8.0.",http://ant.apache.org/antlibs/props/,ant,False,Unknown,Unknown
projects,Apache VSS Ant Library,Apache VSS Ant Library,build-management,The Apache VSS Antlib provides an interface to the Microsoft Visual SourceSafe SCM. The original Ant tasks have been expanded upon in this Antlib. Some fixes to issues in the original tasks have also been incorporated.,http://ant.apache.org/antlibs/proper.html,ant,False,Unknown,Unknown
projects,Apache Portable Runtime,Apache Portable Runtime,library,"
The mission of the Apache Portable Runtime (APR) project is to create
and maintain software libraries that provide a predictable and
consistent interface to underlying platform-specific implementations.
The primary goal is to provide an API to which software developers may
code and be assured of predictable if not identical behaviour
regardless of the platform on which their software is built, relieving
them of the need to code special-case conditions to work around or
take advantage of platform-specific deficiencies or features.
    ",https://apr.apache.org/,apr,False,Unknown,Unknown
projects,Apache Aries,Apache Aries,library,"The Aries project is delivering a set of pluggable Java components enabling an enterprise OSGi application programming model. This includes implementations and extensions of application-focused specifications defined by the OSGi Alliance Enterprise Expert Group (EEG) and an assembly format for multi-bundle applications, for deployment to a variety of OSGi based runtimes.",https://aries.apache.org/,aries,False,Unknown,Unknown
projects,Apache Arrow,Apache Arrow,"big-data, database, data-engineering, library, network-client, network-server","Apache Arrow defines a language-independent columnar memory format for flat and nested data, organized for efficient analytic operations on modern hardware like CPUs and GPUs. The Arrow memory format also supports zero-copy reads for lightning-fast data access without serialization overhead.

Arrow's libraries implement the format and provide building blocks for a range of use cases, including high performance analytics. Many popular projects use Arrow to ship columnar data efficiently or as the basis for analytic engines.

Libraries are available for C, C++, C#, Go, Java, JavaScript, Julia, MATLAB, Python, R, Ruby, and Rust.

Apache Arrow is software created by and for the developer community. We are dedicated to open, kind communication and consensus decision making. Our committers come from a range of organizations and backgrounds, and we welcome all to participate with us.",https://arrow.apache.org,arrow,False,Unknown,Unknown
projects,Apache Any23,Apache Any23,"retired, content","Apache Any23 is used in major Web of Data applications. It is written in Java and licensed under the Apache License v2.0. Apache Any23 can be used in various ways:
* As a library in Java applications that consume structured data from the Web.
* As a command-line tool for extracting and converting between the supported formats.
* As online service API available at any23.org.",http://any23.apache.org,attic,False,Unknown,Unknown
projects,Apache Apex,Apache Apex,"retired, big-data","Apache Apex is a unified platform for big data stream and batch processing. Use cases include ingestion, ETL, real-time analytics, alerts and real-time actions. Apex is a Hadoop-native YARN implementation and uses HDFS by default. It simplifies development and productization of Hadoop applications by reducing time to market. Key features include Enterprise Grade Operability with Fault Tolerance, State Management, Event Processing Guarantees, No Data Loss, In-memory Performance & Scalability and Native Window Support.",http://apex.apache.org,attic,False,Unknown,Unknown
projects,Apache Archiva,Apache Archiva,"retired, build-management","Archiva is the perfect companion for build tools such as Maven, Continuum, and ANT. Archiva offers several capabilities, amongst which remote repository proxying,
security access management, build artifact storage, delivery, browsing, indexing and usage reporting, extensible scanning functionality and many more!",https://archiva.apache.org,attic,False,Unknown,Unknown
projects,Apache Beehive,Apache Beehive,"web-framework, retired","Our goal is to make J2EE programming easier by building a simple object model on J2EE and Struts. Using Java 5 annotations, Beehive reduces the coding necessary for J2EE. The initial Beehive project has three pieces.

NetUI: An annotation-driven web application programming framework that is built atop Struts. NetUI centralizes navigation logic, state, metadata, and exception handling in a single encapsulated and reusable Page Flow Controller class. In addition, NetUI provides a set of JSP tags for rendering HTML / XHTML and higher-level UI constructs such as data grids and trees and has first-class integration with JavaServer Faces and Struts.
 
Controls: A lightweight, metadata-driven component framework that reduces the complexity of being a client of enterprise resources. Controls provide a unified client abstraction that can be implemented to access a diverse set of enterprise resources using a single configuration model.

Web Service Metadata (WSM): An implementation of JSR 181 which standardizes a simplified, annotation-driven model for building Java web services.

In addition, Beehive includes a set of system controls that are abstractions for low-level J2EE resource APIs such as EJB, JMS, JDBC, and web services.",http://beehive.apache.org,attic,False,Unknown,Unknown
projects,Apache Buildr,Apache Buildr,"retired, build-management","We wanted something that's simple and intuitive to use, so we only need to tell it what to do, and it takes care of the rest.  But also something we can easily extend for those one-off tasks, with a language that's a joy to use.",http://buildr.apache.org,attic,False,Unknown,Unknown
projects,Apache Chemistry,Apache Chemistry,"retired, library","Apache Chemistry provides open source implementations of the Content Management Interoperability Services (CMIS) specification. Libraries are available for Java, Python, PHP and .NET.",http://chemistry.apache.org,attic,False,Unknown,Unknown
projects,Apache Chukwa,Apache Chukwa,"retired, hadoop","
      Chukwa is an open source data collection system for monitoring 
      large distributed systems. Chukwa is built on top of 
      the Hadoop Distributed File System (HDFS) and Map/Reduce framework 
      and inherits Hadoop’s scalability and robustness. Chukwa also includes 
      a ﬂexible and powerful toolkit for displaying, monitoring and analyzing 
      results to make the best use of the collected data.
    ",http://chukwa.apache.org/,attic,False,Unknown,Unknown
projects,Apache Clerezza,Apache Clerezza,"retired, osgi, content","Clerezza allows to easily develop semantic web applications by providing tools to manipulate RDF data, create RESTful Web Services and Renderlets using ScalaServerPages. Contents are stored as triples based on W3C RDF specification. These triples are stored via Clerezza’s Smart Content Binding (SCB). SCB defines a technology-agnostic layer to access and modify triple stores. It provides a java implementation of the graph data model specified by W3C RDF and functionalities to operate on that data model. SCB offers a service interface to access multiple named graphs and it can use various providers to manage RDF graphs in a technology specific manner, e.g., using Jena or Sesame. It also provides for adaptors that allow an application to use various APIs (including the Jena api) to process RDF graphs. Furthermore, SCB offers a serialization and a parsing service to convert a graph into a certain representation (format) and vice versa.",http://clerezza.apache.org,attic,False,Unknown,Unknown
projects,Apache Click,Apache Click,"retired, library, network-server, network-client, xml, web-framework","Apache Click is a modern Java web application framework, providing
    a natural rich client style programming model. Click provides a page and
    component oriented design with a event based programming model. Leveraging
    a stateless architecture Click encourages loosely coupled pages for
    easier maintenance. Click is designed to be very easy to learn and use, with
    developers getting up and running within a day. Support is provided for Velocity,
    JSP or FreeMarker page rendering. Click also provides exceptional performance
    for high volume web sites.
    ",http://click.apache.org,attic,False,Unknown,Unknown
projects,Apache Cocoon,Apache Cocoon,"database, graphics, http, network-client, network-server, web-framework, xml, retired","Apache Cocoon is a web development framework built around the concepts of separation of concerns (making sure people can interact and collaborate on a project, without stepping on each other toes) and component-based web development. Cocoon implements these concepts around the notion of ""component pipelines"", each component on the pipeline specializing on a particular operation. This makes it possible to use a ""building block"" approach for web solutions, hooking together components into pipelines without any required programming.",http://cocoon.apache.org/,attic,False,Unknown,Unknown
projects,Apache Continuum,Apache Continuum,"build-management, retired","Whether you have a centralized build team or want to put control of releases in the hands of developers, Apache Continuum can help you improve quality and maintain a consistent build environment. Follow us on Twitter @apachecontinuum to get the latest news and updates!",http://continuum.apache.org,attic,False,Unknown,Unknown
projects,Apache Crunch,Apache Crunch,"retired, big-data, library","The Apache Crunch Java library provides a framework for writing, testing, and running MapReduce pipelines. Its goal is to make pipelines that are composed of many user-defined functions simple to write, easy to test, and efficient to run.

Running on top of Hadoop MapReduce and Apache Spark, the Apache Crunch™ library is a simple Java API for tasks like joining and data aggregation that are tedious to implement on plain MapReduce. The APIs are especially useful when processing data that does not fit naturally into relational model, such as time series, serialized object formats like protocol buffers or Avro records, and HBase rows and columns. For Scala users, there is the Scrunch API, which is built on top of the Java APIs and includes a REPL (read-eval-print loop) for creating MapReduce pipelines.",http://crunch.apache.org,attic,False,Unknown,Unknown
projects,Apache Deltacloud,Apache Deltacloud,"cloud, library, retired","Deltacloud contains a cloud abstraction API - whether the Deltacloud classic API, the DMTF CIMI API or even the EC2 API. Each abstraction API works as a wrapper around a large number of clouds, shielding users from their differences. For every cloud provider there is a driver ""speaking"" that cloud provider's native API, freeing you from dealing with the particulars of each cloud's API.",http://deltacloud.apache.org,attic,False,Unknown,Unknown
projects,Apache DeviceMap,Apache DeviceMap,"mobile, retired","Apache Devicemap is a data repository containing devices attributes, and their related browsers, and operating systems. The project also maintains an api to classify these attributes. ",http://devicemap.apache.org,attic,False,Unknown,Unknown
projects,Apache DirectMemory,Apache DirectMemory,"big-data, retired",Apache DirectMemory is a off-heap cache for the Java Virtual Machine,http://directmemory.apache.org,attic,False,Unknown,Unknown
projects,Apache ECS,Apache ECS,"library, retired","The Element Construction Set is a Java API for generating elements for various markup languages it directly supports HTML 4.0 and XML, but can easily be extended to create tags for any markup language.",http://jakarta.apache.org/ecs/,attic,False,Unknown,Unknown
projects,Apache ESME,Apache ESME,"content, retired","Apache ESME (Enterprise Social Messaging Environment) is a secure and highly scalable microsharing and micromessaging platform that allows people to discover and meet one another and get controlled access to other sources of information, all in a business process context.   
You can hardly turn a web page these days without seeing a story that describes how people are using social networks, whether it is Twitter, Facebook or some other service to develop and build their personal communities. In business, we increasingly see blogs and wikis demonstrating utility in problem solving and communications but the real time nature of business process problem solving largely remains untouched by social networking tools. Existing services, while attractive do not scale well and have proven unreliable. This is unacceptable to business which must be 'Always On' and able to support people in their daily working lives. Such applications must therefore be scalable and reliable but also provide a lot more.
When solving problems, how good might it be if a user was able to tap into the collective knowledge of her peers or surrounding groups of people with whom she might naturally network in the workplace setting? How much quicker and with greater precision might she be able to solve daily problems? What if there was a communications mechanism that takes the best of what services like Twitter offers and co-mingled that with readily recognizable business processes? That solution is Apache ESME.",http://esme.apache.org,attic,False,Unknown,Unknown
projects,Apache Etch,Apache Etch,"network-server, network-client, library, retired","Etch is a cross-platform, language- and transport-independent framework for building and consuming network services. The Etch toolset includes a network service description language, a compiler, and binding libraries for a variety of programming languages. Etch is also transport-independent, allowing for a variety of different transports to be used based on need and circumstance. The goal of Etch is to make it simple to define small, focused services that can be easily accessed, combined, and deployed in a similar manner. With Etch, service development and consumption becomes no more difficult than library development and consumption.",http://etch.apache.org,attic,False,Unknown,Unknown
projects,Apache Excalibur,Apache Excalibur,"network-server, retired","The predecessor of Apache Avalon, Apache Excalibur hosts the Avalon framework, a Java container framework, the Excalibur and Fortress inversion of control containers, and a rich library of components.  Excalibur code powers Apache James and Cocoon and numerous other open source and commercial projects.",http://excalibur.apache.org,attic,False,Unknown,Unknown
projects,Apache Falcon,Apache Falcon,"big-data, retired","Apache Falcon is a data processing and management solution for Hadoop designed for data motion, coordination of data pipelines, lifecycle management, and data discovery. Falcon enables end consumers to quickly onboard their data and its associated processing and management tasks on Hadoop clusters.",http://falcon.apache.org,attic,False,Unknown,Unknown
projects,Apache Forrest,Apache Forrest,"retired, build-management, database, graphics, http, network-client, network-server, web-framework, xml","
      Apache Forrest™ software is a publishing framework that transforms
      input from various sources into a unified presentation in one or more
      output formats. The modular and extensible plug-in architecture of
      Apache Forrest is based on Apache Cocoon and the relevant industry
      standards that separate presentation from content. Forrest can generate
      static documents, or be used as a dynamic server, or be deployed by its
      automated facility.
    ",http://forrest.apache.org/,attic,False,Unknown,Unknown
projects,Apache Giraph,Apache Giraph,"retired, big-data","Apache Giraph is an iterative graph processing system built for high scalability. For example, it is currently used at Facebook to analyze the social graph formed by users and their connections. ",http://giraph.apache.org,attic,False,Unknown,Unknown
projects,Apache Hama,Apache Hama,"retired, big-data",The Apache Hama is an efficient and scalable general-purpose BSP computing engine which can be used to speed up a large variety of compute-intensive analytics applications.,http://hama.apache.org,attic,False,Unknown,Unknown
projects,Apache Harmony,Apache Harmony,"virtual-machine, retired"," Apache Harmony software is a modular Java runtime with class libraries and associated tools.
    ",http://harmony.apache.org/,attic,False,Unknown,Unknown
projects,Apache Hivemind,Apache Hivemind,"library, retired","HiveMind is a framework for creating applications, not an application, or even an application server, itself. The 'core' of HiveMind is the startup logic that knows how to parse and understand the module deployment descriptors, and use that information to instantiate and initialize all those services and configurations.",http://hivemind.apache.org/,attic,False,Unknown,Unknown
projects,Apache Jakarta Cactus,Apache Jakarta Cactus,"testing, retired","The intent of Cactus is to lower the cost of writing tests for server-side code. It uses JUnit and extends it.

Cactus implements an in-container strategy, meaning that tests are executed inside the container. ",http://jakarta.apache.org/cactus,attic,False,Unknown,Unknown
projects,Apache Lens,Apache Lens,"retired, big-data","Lens provides an Unified Analytics interface.
      Lens aims to cut the Data Analytics silos by providing a single view of data across
      multiple tiered data stores and optimal execution environment for the analytical query.
      It seamlessly integrates Hadoop with traditional data warehouses to appear like one.
    ",http://lens.apache.org/,attic,False,Unknown,Unknown
projects,Apache Lenya,Apache Lenya,"web-framework, xml, retired","Apache Lenya is an Open Source Java/XML Content Management Framework and comes with revision control, site management, scheduling, search, WYSIWYG editors, and workflow.",http://lenya.apache.org,attic,False,Unknown,Unknown
projects,Apache Lucy,Apache Lucy,"database, retired",The Apache Lucy search engine library provides full-text search for dynamic programming languages.,http://lucy.apache.org/,attic,False,Unknown,Unknown
projects,Apache Marmotta,Apache Marmotta,retired,"The goal of Apache Marmotta is to provide an open implementation of a Linked Data Platform that can be used, extended and deployed easily by organizations who want to publish Linked Data or build custom applications on Linked Data",http://marmotta.apache.org,attic,False,Unknown,Unknown
projects,Apache MetaModel,Apache MetaModel,"database, big-data, library, retired","With MetaModel you get a uniform connector and query API to many very different datastore types, including: Relational (JDBC) databases, CSV files, Excel spreadsheets, XML files, JSON files, Fixed width files, MongoDB, Apache CouchDB, Apache HBase, Apache Cassandra, ElasticSearch, OpenOffice.org databases, Salesforce.com, SugarCRM and even collections of plain old Java objects (POJOs).

MetaModel isn't a data mapping framework. Instead we emphasize abstraction of metadata and ability to add data sources at runtime, making MetaModel great for generic data processing applications, less so for applications modeled around a particular domain.",http://metamodel.apache.org,attic,False,Unknown,Unknown
projects,Apache MRUnit,Apache MRUnit,"library, retired",The Apache MRUnit is a Java library that helps developers unit test Apache Hadoop map reduce jobs.,http://mrunit.apache.org,attic,False,Unknown,Unknown
projects,Apache MXNet,Apache MXNet,"retired, big-data","Apache MXNet is a deep learning framework designed for both efficiency and flexibility. It's lightweight, Portable, Flexible Distributed/Mobile Deep Learning with dynamic, mutation-aware data-flow dependency scheduler; for Python, R, Julia, Scala, Go, Javascript and more",https://mxnet.apache.org,attic,False,Unknown,Unknown
projects,Apache ODE,Apache ODE,"retired, xml, network-server","Apache ODE (Orchestration Director Engine) executes business processes written following the WS-BPEL standard. It talks to web services, sending and receiving messages, handling data manipulation and error recovery as described by your process definition. It supports both long and short living process executions to orchestrate all the services that are part of your application.

WS-BPEL is an XML-based language defining several constructs to write business processes. It defines a set of basic control structures like conditions or loops as well as elements to invoke web services and receive messages from services. It relies on WSDL to express web services interfaces. Message structures can be manipulated, assigning parts or the whole of them to variables that can in turn be used to send other messages.",http://ode.apache.org,attic,False,Unknown,Unknown
projects,Apache Oltu - Parent,Apache Oltu - Parent,"library, retired",Apache Oltu is an OAuth protocol implementation in Java.,https://oltu.apache.org/,attic,False,Unknown,Unknown
