forkCount,licenseInfo,isInOrganization,archivedAt,latestRelease,shortDescriptionHTML,updatedAt,homepageUrl,url,primaryLanguage,stargazerCount,createdAt,isFork
843,MIT License,False,2024-05-07T04:29:05Z,2020-05-16T16:41:45Z,More than just another GUI to Kong Admin API,2025-05-21T13:37:12Z,,https://github.com/pantsel/konga,JavaScript,4332,2016-10-22T09:28:23Z,False
1037,MIT License,True,2024-01-29T09:20:01Z,2024-01-21T18:03:26Z,DEPRECATED Translating your AngularJS 1.x apps,2025-05-09T05:33:28Z,https://angular-translate.github.io,https://github.com/angular-translate/angular-translate,JavaScript,4315,2013-03-28T11:56:30Z,False
243,MIT License,False,2023-09-19T11:35:00Z,2019-04-22T17:05:27Z,"👀 Vue in React, React in Vue. Seamless integration of the two. 👯",2025-05-16T08:15:15Z,,https://github.com/akxcv/vuera,JavaScript,4314,2017-09-27T21:26:27Z,False
812,MIT License,True,2018-01-14T06:00:13Z,2014-02-09T23:15:15Z,Customizable sliding view controller container.,2025-04-30T09:24:16Z,,https://github.com/ECSlidingViewController/ECSlidingViewController,Objective-C,4310,2012-01-25T22:54:29Z,False
414,MIT License,False,2025-04-02T13:57:55Z,2024-05-05T00:32:13Z,Notify users when a new version of your app is available and prompt them to upgrade.,2025-05-20T14:03:00Z,http://sabintsev.com/,https://github.com/ArtSabintsev/Siren,Swift,4296,2015-01-03T23:28:11Z,False
353,"BSD 2-Clause ""Simplified"" License",True,2025-01-31T13:52:29Z,2018-07-06T03:11:12Z,C/C++ Performance Profiler,2025-05-20T01:37:43Z,https://orbitprofiler.com/,https://github.com/google/orbit,C++,4284,2017-09-21T14:28:35Z,False
653,MIT License,False,2022-09-09T23:46:54Z,,"Export existing AWS resources to Terraform style (tf, tfstate) / No longer actively maintained",2025-05-20T22:09:55Z,http://terraforming.dtan4.net/,https://github.com/dtan4/terraforming,Ruby,4282,2015-03-25T03:50:06Z,False
635,Apache License 2.0,True,2024-07-24T20:33:44Z,2020-06-27T15:43:57Z,SimCLRv2 - Big Self-Supervised Models are Strong Semi-Supervised Learners,2025-05-22T07:39:12Z,https://arxiv.org/abs/2006.10029,https://github.com/google-research/simclr,Jupyter Notebook,4280,2020-03-10T16:53:22Z,False
214,Mozilla Public License 2.0,True,2020-06-27T00:13:58Z,,Development and deployment made easy.,2025-04-28T04:06:04Z,https://www.ottoproject.io/,https://github.com/hashicorp/otto,HTML,4253,2015-06-01T13:17:26Z,False
2636,Apache License 2.0,True,2025-01-14T15:57:22Z,2017-02-11T16:17:39Z,Code and walkthrough labs to set up serverless applications for Wild Rydes workshops,2025-05-17T21:50:11Z,http://wildrydes.com,https://github.com/aws-samples/aws-serverless-workshops,JavaScript,4240,2016-11-22T22:47:29Z,False
922,GNU General Public License v3.0,False,2023-07-11T04:25:27Z,2022-02-14T13:09:34Z,A frida tool to dump dex in memory to support security engineers analyzing malware.,2025-05-22T07:20:03Z,,https://github.com/hluwa/frida-dexdump,Python,4238,2020-01-07T12:36:10Z,False
645,Apache License 2.0,True,2022-05-26T20:56:28Z,2021-05-16T08:01:54Z,"Read and write spreadsheet files (CSV, XLSX and ODS), in a fast and scalable way",2025-05-21T08:46:50Z,http://opensource.box.com/spout/,https://github.com/box/spout,PHP,4238,2015-01-14T00:36:25Z,False
125,MIT License,False,2024-03-06T17:43:49Z,,Happiness in the form of faster webpack build times.,2025-04-27T20:31:00Z,,https://github.com/amireh/happypack,JavaScript,4231,2015-12-27T12:39:00Z,False
541,"BSD 3-Clause ""New"" or ""Revised"" License",False,2021-10-26T19:17:00Z,2015-02-18T21:12:01Z, Interactive diagrams of Rx Observables,2025-04-18T06:01:36Z,http://www.rxmarbles.com,https://github.com/staltz/rxmarbles,JavaScript,4216,2014-07-16T17:09:55Z,False
280,MIT License,True,2024-11-08T09:04:01Z,2021-11-16T12:37:56Z,Language-agnostic HTTP API Testing Tool,2025-05-21T23:45:12Z,https://dredd.org,https://github.com/apiaryio/dredd,JavaScript,4211,2013-09-04T12:21:35Z,False
570,Apache License 2.0,True,2024-03-15T13:22:03Z,,Official DeiT repository,2025-05-21T07:50:45Z,,https://github.com/facebookresearch/deit,Python,4201,2020-12-23T17:44:43Z,False
1369,"BSD 3-Clause ""New"" or ""Revised"" License",True,2024-05-13T12:14:18Z,2017-05-04T14:19:57Z,appr.tc has been shutdown. Please use the Dockerfile to run your own test/dev instance.,2025-05-22T03:04:26Z,,https://github.com/webrtc/apprtc,JavaScript,4201,2015-02-03T18:10:41Z,False
660,Apache License 2.0,True,2021-02-17T07:49:16Z,2017-06-02T20:31:53Z,A framework to make it easy for developers to add product tours to their pages.,2025-05-22T03:26:39Z,,https://github.com/LinkedInAttic/hopscotch,JavaScript,4187,2013-05-16T01:46:02Z,False
1378,"BSD 3-Clause ""New"" or ""Revised"" License",True,2025-01-07T04:35:52Z,2018-04-10T17:02:37Z,Deep Learning GPU Training System,2025-05-06T23:18:27Z,https://developer.nvidia.com/digits,https://github.com/NVIDIA/DIGITS,HTML,4182,2015-03-17T16:00:20Z,False
479,Apache License 2.0,False,2019-05-23T17:17:49Z,2016-08-30T14:50:59Z,"IntelliJ/AndroidStudio plugin which provides a button to connect your Android device over WiFi to install, run and debug your applications without a USB connected.",2025-05-06T19:50:54Z,,https://github.com/pedrovgs/AndroidWiFiADB,Java,4149,2015-10-18T21:58:45Z,False
524,zlib License,True,2022-10-01T15:18:39Z,,"This repository contains several applications, demonstrating the Meltdown bug.",2025-05-21T18:24:20Z,https://meltdownattack.com,https://github.com/isec-tugraz/meltdown,C,4139,2018-01-03T09:42:18Z,False
231,MIT License,False,2023-07-29T12:45:55Z,2017-06-16T02:16:24Z,A vim plugin to display the indention levels with thin vertical lines,2025-05-11T16:59:22Z,,https://github.com/Yggdroot/indentLine,Vim Script,4137,2012-11-27T16:52:11Z,False
273,GNU General Public License v3.0,True,2021-12-28T13:01:47Z,,(discontinued) Your all-purpose markdown editor.,2025-05-18T07:14:39Z,https://moeditor.github.io,https://github.com/Moeditor/Moeditor,JavaScript,4136,2016-06-24T01:11:26Z,False
299,Apache License 2.0,True,2024-06-12T11:55:32Z,,"End-To-End is a crypto library to encrypt, decrypt, digital sign, and verify signed messages (implementing OpenPGP)",2025-05-20T14:56:07Z,,https://github.com/google/end-to-end,JavaScript,4136,2014-10-07T20:39:09Z,False
926,MIT License,False,2024-11-04T17:28:54Z,2022-08-31T19:38:17Z,"Simple, modern &amp; fast web-based email client",2025-05-17T16:13:33Z,http://rainloop.net,https://github.com/RainLoop/rainloop-webmail,PHP,4127,2013-09-24T18:31:24Z,False
196,Apache License 2.0,True,2021-06-10T22:20:10Z,2015-11-17T18:12:05Z,Codemod is a tool/library to assist you with large-scale codebase refactors that can be partially automated but still require human oversight and occasional intervention. Codemod was developed at F…,2025-05-21T08:39:41Z,,https://github.com/facebookarchive/codemod,Python,4118,2009-04-02T04:51:54Z,False
180,MIT License,False,2024-04-26T14:18:16Z,2020-09-22T15:52:28Z,📁 A simple file manager written in bash.,2025-05-21T19:45:02Z,,https://github.com/dylanaraps/fff,Shell,4113,2018-10-18T23:09:21Z,False
355,MIT License,False,2024-04-19T17:36:26Z,2023-06-13T08:58:08Z,A golang library for building interactive and accessible prompts with full support for windows and posix terminals.,2025-05-21T19:54:52Z,,https://github.com/AlecAivazis/survey,Go,4112,2016-10-30T17:03:15Z,False
525,MIT License,True,2021-10-08T10:11:29Z,2019-03-12T11:47:16Z,"Tangram is a modular UI solution for building native page dynamically including Tangram for Android, Tangram for iOS and even backend CMS. This project provides the sdk on Android.",2025-05-21T02:17:14Z,http://tangram.pingguohe.net/,https://github.com/alibaba/Tangram-Android,Java,4112,2017-03-29T13:29:57Z,False
448,MIT License,True,2019-07-08T05:05:07Z,,`stringWithFormat:` for the sophisticated hacker set,2025-04-29T09:27:52Z,,https://github.com/FormatterKit/FormatterKit,Objective-C,4109,2011-07-25T20:27:48Z,False
893,GNU General Public License v3.0,True,2024-01-10T18:00:16Z,2020-04-23T02:38:41Z,Veil 3.1.X (Check version info in Veil at runtime),2025-05-21T20:14:57Z,,https://github.com/Veil-Framework/Veil,Python,4100,2017-03-02T08:04:43Z,False
264,MIT License,True,2024-12-01T21:29:50Z,2021-10-02T09:50:12Z,"Superseded by abstract-level. A wrapper for abstract-leveldown compliant stores, for Node.js and browsers.",2025-04-26T04:02:47Z,,https://github.com/Level/levelup,JavaScript,4086,2012-08-13T14:32:00Z,False
1038,GNU General Public License v3.0,True,2023-07-19T13:58:11Z,,This tool compares a targets patch levels against the Microsoft vulnerability database in order to detect potential missing patches on the target. It also notifies the user if there are public expl…,2025-05-21T21:18:33Z,,https://github.com/AonCyberLabs/Windows-Exploit-Suggester,Python,4066,2014-07-08T13:16:28Z,False
282,Apache License 2.0,True,2022-01-13T07:02:41Z,,A testing system for catching visual regressions in Web applications.,2025-05-15T12:22:04Z,,https://github.com/facebookarchive/huxley,Python,4062,2013-07-30T06:01:12Z,False
1151,GNU General Public License v3.0,False,2024-12-19T10:10:33Z,,Official Black Hat Arsenal Security Tools Repository,2025-05-20T19:43:35Z,https://www.toolswatch.org/category/arsenal/,https://github.com/toolswatch/blackhat-arsenal-tools,,4059,2017-07-21T08:03:44Z,False
839,Apache License 2.0,True,2024-10-23T15:26:28Z,2019-09-10T23:07:30Z,Deploy and manage containers (including Docker) on top of Apache Mesos at scale.,2025-05-13T01:04:14Z,https://mesosphere.github.io/marathon/,https://github.com/d2iq-archive/marathon,Scala,4057,2013-06-25T14:56:34Z,False
161,GNU General Public License v2.0,False,2020-12-15T07:47:24Z,2020-12-14T23:12:01Z,ARCHIVED! This plugin is officially a part of OBS as of version 26.1. See note below for info on upgrading. 🎉🎉🎉Creates a virtual webcam device from the output of OBS. Especially useful for streamin…,2025-05-20T02:27:42Z,,https://github.com/johnboiles/obs-mac-virtualcam,Objective-C++,4056,2020-04-01T20:08:12Z,False
165,Apache License 2.0,True,2022-03-24T05:19:08Z,2020-02-18T21:15:41Z,"Lucet, the Sandboxing WebAssembly Compiler.",2025-05-15T13:06:02Z,,https://github.com/bytecodealliance/lucet,Rust,4053,2018-12-07T21:27:18Z,False
1270,MIT License,True,2023-01-21T00:03:26Z,,"Open Graph Image as a Service - generate cards for Twitter, Facebook, Slack, etc",2025-05-19T23:32:53Z,https://og-image.vercel.app,https://github.com/vercel/og-image,TypeScript,4052,2019-01-02T00:20:14Z,False
1183,MIT License,True,2023-11-01T23:20:40Z,,This repository contains the list of communities and job portals you can join and apply to.,2025-05-22T07:31:18Z,https://www.wemakedevs.org/,https://github.com/WeMakeDevs/roadmaps,,4051,2022-07-17T17:49:36Z,False
390,MIT License,True,2025-03-24T07:00:31Z,2023-04-13T18:01:49Z,High performance HTTP server based on Swoole. Speed up your Laravel or Lumen applications.,2025-05-16T06:45:03Z,,https://github.com/swooletw/laravel-swoole,PHP,4044,2017-11-06T14:37:03Z,False
483,MIT License,True,2024-11-22T15:13:59Z,2023-08-11T17:15:00Z,Server-side rendering and Prerendering for Angular,2025-05-11T15:25:09Z,,https://github.com/angular/universal,TypeScript,4030,2015-06-24T01:07:44Z,False
518,MIT License,True,2020-09-02T03:53:56Z,2019-03-11T14:52:57Z,Bolts is a collection of low-level libraries designed to make developing mobile apps easier.,2025-05-06T05:18:48Z,http://boltsframework.github.io/Bolts-Android/,https://github.com/BoltsFramework/Bolts-Android,Java,4010,2014-01-30T04:58:14Z,False
512,MIT License,True,2019-05-29T19:04:03Z,2017-10-25T17:11:16Z,[DEPRECATED] Please use https://github.com/webpack-contrib/mini-css-extract-plugin Extracts text from a bundle into a separate file,2025-05-06T12:17:10Z,,https://github.com/webpack-contrib/extract-text-webpack-plugin,JavaScript,4006,2014-01-28T00:28:36Z,False
343,GNU General Public License v3.0,False,2024-12-08T22:46:11Z,,Free Client for OneDrive on Linux,2025-05-12T15:59:35Z,,https://github.com/skilion/onedrive,D,3997,2015-09-22T18:58:17Z,False
236,MIT License,True,2023-06-20T12:43:55Z,2020-12-21T14:13:50Z,A blazing fast js bundler/loader with a comprehensive API 🔥,2025-04-29T05:38:50Z,http://fuse-box.org,https://github.com/fuse-box/fuse-box,JavaScript,3991,2016-10-28T10:37:16Z,False
330,MIT License,False,2024-08-23T15:50:34Z,2024-08-23T15:47:35Z,go chart is a basic charting library in go.,2025-05-20T20:24:53Z,,https://github.com/wcharczuk/go-chart,Go,3991,2016-07-08T00:14:58Z,False
2168,GNU General Public License v3.0,True,2021-10-28T17:20:25Z,2019-12-16T19:54:14Z,"Aleth – Ethereum C++ client, tools and libraries",2025-05-12T07:22:31Z,,https://github.com/ethereum/aleth,C++,3978,2013-12-26T21:26:06Z,False
488,"BSD 3-Clause ""New"" or ""Revised"" License",True,2021-05-09T05:28:52Z,,[mirror] This is a linter for Go source code. (deprecated),2025-05-16T09:13:56Z,,https://github.com/golang/lint,Go,3976,2013-06-02T22:45:37Z,False
602,MIT License,False,2024-08-12T21:24:05Z,,Scrape the Twitter Frontend API without authentication.,2025-05-20T12:03:46Z,,https://github.com/bisguzar/twitter-scraper,Python,3975,2018-02-22T14:58:34Z,False
861,GNU General Public License v3.0,False,2025-01-06T18:52:16Z,2021-02-06T13:31:49Z,"FFmpeg for Android, iOS and tvOS. Not maintained anymore. Superseded by FFmpegKit.",2025-05-21T10:04:27Z,https://tanersener.github.io/mobile-ffmpeg,https://github.com/tanersener/mobile-ffmpeg,C,3970,2018-02-27T13:49:45Z,False
581,Apache License 2.0,True,2022-09-14T22:27:46Z,2015-10-05T21:27:06Z,Swagger module for node.js,2025-05-15T11:27:03Z,http://swagger.io,https://github.com/swagger-api/swagger-node,JavaScript,3965,2011-08-17T03:51:37Z,False
240,MIT License,True,2019-03-07T04:59:29Z,,Stochastic flame graph profiler for Go programs,2025-05-20T04:33:04Z,,https://github.com/uber-archive/go-torch,Go,3956,2015-07-21T22:49:42Z,False
527,MIT License,True,2023-10-31T22:34:17Z,,"Learning embeddings for classification, retrieval and ranking.",2025-05-07T04:48:44Z,,https://github.com/facebookresearch/StarSpace,C++,3953,2017-06-28T17:50:18Z,False
1502,MIT License,True,2022-02-24T20:51:56Z,2017-06-15T00:26:09Z,A self-driving car simulator built with Unity,2025-05-20T04:14:00Z,http://udacity.com/self-driving-car,https://github.com/udacity/self-driving-car-sim,C#,3949,2017-02-08T03:31:26Z,False
1277,GNU Lesser General Public License v3.0,False,2025-01-20T16:40:33Z,,Async Web Server for ESP8266 and ESP32,2025-05-17T22:11:19Z,,https://github.com/me-no-dev/ESPAsyncWebServer,C++,3947,2015-12-19T16:53:57Z,False
2289,Apache License 2.0,True,2025-03-11T13:19:13Z,2024-11-20T13:08:45Z,A collection of Solana programs maintained by Solana Labs,2025-05-22T06:10:00Z,https://solanalabs.com,https://github.com/solana-labs/solana-program-library,Rust,3944,2020-05-29T19:39:19Z,False
925,MIT License,True,2024-01-12T17:50:42Z,2020-11-30T18:05:56Z,Microsoft Quantum Development Kit Samples,2025-05-21T18:50:32Z,https://docs.microsoft.com/quantum,https://github.com/microsoft/Quantum,Jupyter Notebook,3944,2017-11-08T23:24:33Z,False
654,GNU General Public License v2.0,True,2018-09-24T23:36:31Z,2016-01-11T16:56:46Z,The WP REST API has been merged into WordPress core. Please do not create issues or send pull requests. Submit support requests to the forums or patches to Trac (see README below for links).,2025-05-15T07:51:12Z,https://developer.wordpress.org/rest-api/,https://github.com/WP-API/WP-API,PHP,3943,2013-06-01T10:52:43Z,False
213,Mozilla Public License 2.0,True,2024-02-18T16:14:09Z,,Create and build modern JavaScript projects with zero initial configuration.,2025-05-19T18:44:06Z,https://neutrinojs.org,https://github.com/neutrinojs/neutrino,JavaScript,3936,2017-02-03T03:27:20Z,False
174,MIT License,False,2022-12-21T11:11:35Z,2018-08-24T22:08:05Z,Manage your SSH like a boss.,2025-05-08T03:50:38Z,http://stormssh.readthedocs.org/en/master/,https://github.com/emre/storm,Python,3929,2013-05-20T18:30:39Z,False
706,MIT License,False,2018-10-11T06:32:24Z,2018-10-10T23:17:03Z,Utilities for Go structs,2025-05-21T05:02:02Z,http://godoc.org/github.com/fatih/structs,https://github.com/fatih/structs,Go,3922,2014-07-26T11:08:52Z,False
2442,GNU General Public License v3.0,False,2023-11-03T08:36:22Z,2020-08-24T11:28:12Z,"Automatically crawls proxy nodes on the public internet, de-duplicates and tests for usability and then provides a list of nodes",2025-05-16T06:39:34Z,,https://github.com/zu1k/proxypool,Go,3921,2020-08-11T11:43:01Z,False
790,Apache License 2.0,True,2022-01-13T06:47:26Z,,Scribe is a server for aggregating log data streamed in real time from a large number of servers.,2025-05-21T11:30:30Z,,https://github.com/facebookarchive/scribe,C++,3917,2009-04-02T04:55:56Z,False
391,MIT License,True,2024-06-12T21:35:14Z,2018-08-27T15:58:22Z,A tool for developers to create cloud-native applications on Kubernetes.,2025-05-21T20:02:33Z,https://draft.sh,https://github.com/Azure/draft-classic,Go,3913,2017-05-05T19:47:39Z,False
146,MIT License,True,2022-03-04T06:32:16Z,, Telemetry dashboard for node.js apps from the terminal!,2025-05-20T22:19:44Z,,https://github.com/FormidableLabs/nodejs-dashboard,JavaScript,3910,2016-10-10T05:26:56Z,False
179,MIT License,True,2024-11-18T21:54:23Z,,A JavaScript Internationalization Framework,2025-05-17T19:43:01Z,https://facebook.github.io/fbt,https://github.com/facebook/fbt,JavaScript,3904,2018-08-01T17:39:49Z,False
1793,Apache License 2.0,True,2023-06-16T07:14:24Z,2017-05-15T08:54:16Z,Enterprise Stream Process Engine,2025-05-07T11:24:14Z,http://jstorm.io,https://github.com/alibaba/jstorm,Java,3893,2013-09-03T03:53:16Z,False
311,MIT License,True,2018-01-10T06:59:11Z,2016-09-17T20:48:07Z,"RxJS powered state management for Angular applications, inspired by Redux",2025-05-05T08:31:50Z,,https://github.com/ngrx/store,TypeScript,3892,2015-12-13T02:44:59Z,False
769,MIT License,False,2024-02-28T04:04:29Z,,Cloudflare WARP Installer | WARP 一键安装脚本,2025-05-22T02:28:11Z,https://p3terx.com/archives/cloudflare-warp-configuration-script.html,https://github.com/P3TERX/warp.sh,Shell,3891,2021-06-12T12:01:28Z,False
655,Apache License 2.0,True,2024-03-22T02:53:00Z,2020-07-04T16:26:16Z,american fuzzy lop - a security-oriented fuzzer,2025-05-22T06:20:09Z,https://lcamtuf.coredump.cx/afl/,https://github.com/google/AFL,C,3888,2019-07-25T16:50:06Z,False
564,MIT License,True,2024-06-09T23:00:23Z,,Plugins for Auto-GPT,2025-05-19T21:21:54Z,,https://github.com/Significant-Gravitas/Auto-GPT-Plugins,Python,3879,2023-04-09T02:54:14Z,False
472,GNU General Public License v2.0,False,2021-01-27T23:16:01Z,2018-07-14T10:58:03Z,Add the Sseexxyyy live2d to your hexo!,2025-05-13T15:57:51Z,,https://github.com/EYHN/hexo-helper-live2d,JavaScript,3878,2017-01-29T07:05:31Z,False
810,Apache License 2.0,True,2023-01-03T22:54:23Z,2018-01-05T21:36:23Z,Intel® Nervana™ reference deep learning framework committed to best performance on all hardware,2025-05-04T04:32:08Z,http://neon.nervanasys.com/docs/latest,https://github.com/NervanaSystems/neon,Python,3877,2014-10-16T01:00:17Z,False
512,MIT License,False,2025-03-25T06:06:16Z,2017-05-01T02:26:16Z,Arbitrary expression evaluation for golang,2025-05-21T09:53:30Z,,https://github.com/Knetic/govaluate,Go,3876,2014-12-19T10:06:30Z,False
1194,GNU General Public License v3.0,True,2021-09-25T21:22:39Z,2015-08-31T20:23:12Z,Automatic Movie Downloading via NZBs &amp; Torrents,2025-05-08T18:58:14Z,couchpota.to,https://github.com/CouchPotato/CouchPotatoServer,Python,3874,2011-02-06T17:14:17Z,False
813,MIT License,False,2025-03-17T01:52:12Z,2016-07-31T10:22:00Z,adminMongo is a Web based user interface (GUI) to handle all your MongoDB connections/databases needs.,2025-05-19T13:02:08Z,https://adminmongo.markmoffat.com,https://github.com/mrvautin/adminMongo,JavaScript,3872,2016-01-16T07:09:15Z,False
605,Apache License 2.0,True,2023-03-19T21:46:43Z,," Explore how machine learning works, live in the browser. No coding required.",2025-05-21T04:48:33Z,https://g.co/teachablemachine,https://github.com/googlecreativelab/teachable-machine-v1,JavaScript,3872,2017-10-03T15:04:27Z,False
209,MIT License,True,2025-03-13T14:33:42Z,2024-10-07T18:59:21Z,"🔥 Fully-local simulator for Cloudflare Workers. For the latest version, see https://github.com/cloudflare/workers-sdk/tree/main/packages/miniflare.",2025-05-19T01:09:04Z,https://miniflare.dev,https://github.com/cloudflare/miniflare,TypeScript,3867,2021-05-20T09:20:13Z,False
467,Mozilla Public License 2.0,True,2024-12-03T21:21:41Z,2024-12-03T21:20:51Z,Wrapper of syncthing for Android.,2025-05-22T02:15:50Z,https://syncthing.net/,https://github.com/syncthing/syncthing-android,Java,3863,2014-02-22T17:15:19Z,False
645,MIT License,True,2018-11-23T01:38:21Z,,"DEPRECATED - A front-end template that helps you build fast, modern mobile web apps.",2025-05-18T19:54:51Z,,https://github.com/h5bp/mobile-boilerplate,ApacheConf,3845,2010-12-15T14:54:15Z,False
1152,MIT License,True,2025-02-01T16:04:07Z,2017-04-28T15:02:51Z,Source transformer enabling ECMAScript 6 generator functions in JavaScript-of-today.,2025-05-19T01:28:15Z,http://facebook.github.io/regenerator/,https://github.com/facebook/regenerator,JavaScript,3840,2013-10-05T14:37:03Z,False
310,Apache License 2.0,True,2025-04-01T16:56:34Z,2017-08-02T15:34:15Z,The Roboto family of fonts,2025-05-18T07:16:04Z,,https://github.com/googlefonts/roboto-2,Python,3840,2015-04-11T03:59:41Z,False
179,GNU General Public License v3.0,False,2018-11-11T14:36:39Z,,At last – a modern terminal emulator (NO LONGER MAINTAINED),2025-05-15T20:47:59Z,http://finalterm.org,https://github.com/p-e-w/finalterm,Vala,3835,2013-04-16T17:09:52Z,False
518,MIT License,True,2023-12-02T15:47:10Z,2021-11-09T03:33:53Z,Real-Distributed RTC System by pure Go and Flutter,2025-05-15T06:09:23Z,,https://github.com/ionorg/ion,Go,3832,2019-03-11T19:33:13Z,False
476,"BSD 3-Clause ""New"" or ""Revised"" License",True,2020-12-31T20:20:08Z,,An open source email campaign management tool for nonprofits,2025-05-21T22:54:52Z,,https://github.com/freeCodeCamp/mail-for-good,JavaScript,3831,2016-09-01T20:34:38Z,False
371,Apache License 2.0,True,2020-07-02T02:16:38Z,,Find potential bugs in your services with Diffy,2025-05-20T02:32:23Z,https://twitter.com/diffyproject,https://github.com/twitter-archive/diffy,Scala,3830,2015-08-12T19:58:04Z,False
126,"BSD 3-Clause ""New"" or ""Revised"" License",False,2023-09-30T08:17:22Z,2023-08-29T09:20:36Z,Turbopilot is an open source large-language-model based code completion engine that runs locally on CPU,2025-05-17T16:29:28Z,,https://github.com/ravenscroftj/turbopilot,C++,3821,2023-04-09T16:46:33Z,False
506,MIT License,False,2023-12-12T15:23:32Z,,Common code and interview problems solved in multiple languages,2025-05-20T01:15:57Z,,https://github.com/blakeembrey/code-problems,JavaScript,3819,2013-05-22T19:19:29Z,False
711,MIT License,False,2024-04-26T17:15:13Z,,Break free from CSS prefix hell!,2025-05-16T09:32:00Z,http://projects.verou.me/prefixfree/,https://github.com/LeaVerou/prefixfree,JavaScript,3818,2011-10-11T17:30:57Z,False
422,MIT License,False,2025-03-07T08:25:24Z,2019-10-03T11:00:58Z,"📚 Effortless documentation, done right.",2025-05-20T10:19:55Z,https://docute.egoist.dev,https://github.com/egoist/docute,JavaScript,3815,2016-12-08T18:04:40Z,False
305,The Unlicense,True,2024-04-25T23:39:23Z,2020-03-01T01:26:15Z,Karabiner (KeyRemap4MacBook) is a powerful utility for keyboard customization.,2025-05-21T00:34:42Z,https://pqrs.org/osx/karabiner/,https://github.com/pqrs-org/Karabiner-archived,C++,3809,2011-04-17T06:20:42Z,False
1781,Apache License 2.0,True,2023-10-02T12:34:32Z,2019-09-09T01:00:53Z,CapitalOne DevOps Dashboard,2025-05-10T01:48:58Z,http://hygieia.github.io/hygieia,https://github.com/hygieia/hygieia,TypeScript,3786,2015-07-17T05:55:06Z,False
447,MIT License,False,2024-02-05T03:51:12Z,2017-09-07T20:35:37Z,Tabletop.js gives spreadsheets legs,2025-05-10T23:39:32Z,,https://github.com/jsoma/tabletop,JavaScript,3781,2012-02-03T17:35:24Z,False
157,MIT License,False,2019-02-13T00:17:47Z,2017-12-14T19:47:51Z,A UI framework that enables panels on iOS.,2025-05-18T02:06:48Z,,https://github.com/louisdh/panelkit,Swift,3781,2017-02-20T21:36:25Z,False
237,Apache License 2.0,True,2024-03-27T18:03:01Z,2024-02-21T21:39:05Z,container-diff: Diff your Docker containers,2025-05-17T16:16:57Z,,https://github.com/GoogleContainerTools/container-diff,Go,3778,2017-08-07T19:29:12Z,False
2577,GNU General Public License v2.0,False,2022-12-01T10:43:37Z,,将Linux现常用的网络加速集成在一起,2025-05-22T07:24:47Z,,https://github.com/Chikage0o0/Linux-NetSpeed,C,3776,2017-10-31T11:58:48Z,False
631,Apache License 2.0,True,2020-08-18T20:52:22Z,2019-12-03T14:51:29Z,Cryptographic currency implementing Ouroboros PoS protocol,2025-05-18T22:23:31Z,,https://github.com/input-output-hk/cardano-sl,Haskell,3773,2016-10-14T13:44:38Z,False
1378,Apache License 2.0,False,2022-03-17T18:24:11Z,,Fork of Tesseract Tools for Android,2025-05-21T17:00:38Z,,https://github.com/rmtheis/tess-two,C,3772,2011-10-15T11:14:00Z,False
800,MIT License,False,2024-11-27T15:04:39Z,,A list of open source programs.,2025-05-20T20:36:56Z,https://opensourceinternships.herokuapp.com/,https://github.com/tapaswenipathak/Open-Source-Programs,JavaScript,3758,2015-11-27T03:37:32Z,False
994,GNU General Public License v3.0,False,2022-04-12T10:53:37Z,,快速搭建各种漏洞环境(Various vulnerability environment),2025-05-15T11:06:45Z,http://vulapps.evalbug.com/,https://github.com/Medicean/VulApps,Shell,3752,2016-06-16T08:05:30Z,False
657,MIT License,False,2022-07-15T01:04:24Z,,🛰️ List of satellite image training datasets with annotations for computer vision and deep learning,2025-05-21T02:05:10Z,,https://github.com/chrieke/awesome-satellite-imagery-datasets,,3752,2018-05-01T22:13:17Z,False
